{
  "schemaVersion": 4,
  "profile": "complete-layer",
  "screenUnit": "SCR-SVC-CUSTOMERS",
  "sourceMasterId": "CM-CUSTOMER-SERVICE-R1",
  "topologyRegistryEntry": {
    "sourceMasterId": "CM-CUSTOMER-SERVICE-R1",
    "approvalStatus": "approved-by-user",
    "approvalDate": "2026-07-26"
  },
  "screen": {
    "screenIds": ["SCR-SVC-CUSTOMERS"],
    "gameState": "D1-ORDER-001에서 생맥주 1잔만 부분 제공됐고 네기마 3개는 아직 미제공인 주문 수령 대기 상태",
    "playerAction": "바 안쪽 고정 정면 카메라에서 서비스 테이블 너머, 생맥주를 받았지만 네기마를 기다리는 츠키오카를 본다",
    "semanticOwner": "customers.d1.tsukioka.partial-beer-waiting",
    "assetMeaning": "승인 대기 R2와 같은 츠키오카·정면 의자에 생맥주 한 잔만 추가한 부분 수령 대기 complete layer"
  },
  "settingSources": [
    {
      "file": "art-workspace/review/artist-009/customer-screen/r3/customer-service-fhd-r3.png",
      "sha256": "cd7dff413b532dbbd4e96d28b2ec4c6746c995057f1830fe825787bb1c04263f",
      "evidence": "사용자 지정 기준 화면의 츠키오카 identity·정면 손님 카메라·따뜻한 픽셀 화풍을 고정한다."
    },
    {
      "file": "art-workspace/review/artist-000/d1-customer-order/complete-layers/d1-tsukioka/waiting/r2/metadata/provenance.json",
      "sha256": "60dc33024b1b99b61e492ffa03fdb8ff7ce0ef1ffcf48aeb663951fd8b504a75",
      "evidence": "사용자 승인 대기 R2의 동일 인물·정면 의자·FHD 좌표·투명 경계를 부분 제공 상태에도 유지한다."
    }
  ],
  "camera": {
    "position": "가게 안쪽 바 작업자 위치의 고정 정면 카메라",
    "viewDirection": "긴 서비스 테이블을 가로질러 손님석과 중앙 대문/밤 골목을 본다",
    "framing": "16:9 FHD 투명 complete layer. 승인 대기 R2와 같은 츠키오카 위치·정면 의자·스케일을 유지한다."
  },
  "spatialOrder": [
    "player-camera-inside-bar",
    "single-bar-counter",
    "customer-seats",
    "main-entrance-immediately-behind-customer-side",
    "night-alley"
  ],
  "topology": {
    "mainEntranceRelation": "immediately-behind-customer-side-bar",
    "entranceComposition": "single-centered-main-gate-with-closed-side-walls",
    "sideWallsRelation": "closed-from-centered-gate-to-left-and-right-frame-edges",
    "tableRelation": "츠키오카의 하체와 정면 의자는 승인된 단일 긴 서비스 테이블 뒤에서 계속된다",
    "customerOcclusion": "서비스 테이블은 하체·의자 일부를 가리고, 이 레이어는 그 뒤의 신체·의자를 유지한다",
    "backgroundRelation": "배경·대문·골목·벽·선반·램프는 이 손님 레이어에 포함하지 않는다"
  },
  "occludedContinuation": [
    {
      "occluder": "single-full-width-service-table",
      "hiddenSurfaceMustContinueAs": "츠키오카의 하체와 정면 목재 의자가 테이블 뒤에서 자연스럽게 계속된다"
    }
  ],
  "invariants": [
    "녹색 가디건·회색 머리·가는 둥근 안경의 노년 일본인 남성 츠키오카 한 명과 정면을 똑바로 향하는 대칭 목재 의자 한 개만 포함한다",
    "생맥주잔 한 개를 가슴 높이에서 곧게 들고 있으나 마시는 동작은 하지 않는다",
    "네기마·다른 음식은 전혀 없으며, 이는 네기마 3개가 아직 미제공인 부분 수령 대기 상태다",
    "straight-alpha 1920×1080 complete layer이고 네 모서리는 투명이다"
  ],
  "forbiddenSubstitutions": [
    "navy-suit-office-worker",
    "side-facing-or-three-quarter-view-chair",
    "negima-or-any-food",
    "beer-drinking-at-lips",
    "multiple-drinks-plate-tray-coaster-utensil-or-order-mat",
    "other-customer-or-extra-chair",
    "ui-text-quantity-check-gauge-panel-button-or-badge",
    "sealed-rear-wood-wall",
    "full-width-bottle-shelf-wall",
    "deep-back-room",
    "second-counter",
    "off-center-main-entrance",
    "open-side-entrance-bays",
    "door-alley-wall-shelf-lantern-or-any-scene-background",
    "cast-shadow-reflection-or-chroma-background"
  ],
  "inferenceSummary": "기획의 생맥주 부분 제공 뒤에도 네기마 미완료 항목이 남아 손님이 주문 수령 대기 상태를 유지한다는 계약을 시각화한다. 전량 수령 식사·음주 bundle과 혼합하지 않는다.",
  "unresolvedQuestions": [],
  "approval": {
    "status": "user-confirmed",
    "basis": "사용자가 D1 생맥주 부분 제공·네기마 미완료 상태의 다음 단일 후보 제작을 지시했다",
    "date": "2026-07-28"
  },
  "approvedForGeneration": true
}
