{
  "schemaVersion": 4,
  "profile": "complete-layer",
  "screenUnit": "SCR-SVC-CUSTOMERS",
  "sourceMasterId": "CM-CUSTOMER-SERVICE-R1",
  "topologyRegistryEntry": {
    "sourceMasterId": "CM-CUSTOMER-SERVICE-R1",
    "approvalStatus": "approved-by-user",
    "approvalDate": "2026-07-26"
  },
  "screen": {
    "screenIds": ["SCR-SVC-CUSTOMERS"],
    "gameState": "D1: 단일 손님 츠키오카가 주문을 넣고 제공을 기다리는 0차 검증 상태",
    "playerAction": "바 안쪽의 고정 정면 카메라에서 서비스 테이블 너머 츠키오카의 주문 대기 상태를 본다",
    "semanticOwner": "customers.d1.tsukioka.waiting",
    "assetMeaning": "Artist 009 기준 화면의 녹색 가디건·회색 머리·안경 노년 남성 츠키오카 한 명과 의자만 담은, 음식·음료 미수령 대기 complete layer"
  },
  "settingSources": [
    {
      "file": "art-workspace/review/artist-009/customer-screen/r3/customer-service-fhd-r3.png",
      "sha256": "cd7dff413b532dbbd4e96d28b2ec4c6746c995057f1830fe825787bb1c04263f",
      "evidence": "사용자가 이후 작업의 기준 전체 화면으로 직접 지정했다. 이 화면에서 네 번째 손님인 녹색 가디건·회색 머리·안경의 노년 남성을 D1 츠키오카로 직접 바로잡았다."
    }
  ],
  "camera": {
    "position": "가게 안쪽 바 작업자 위치의 고정 정면 카메라",
    "viewDirection": "긴 서비스 테이블을 가로질러 손님석과 중앙 대문/밤 골목을 본다",
    "framing": "16:9 FHD 투명 complete layer. 츠키오카의 머리·상체는 Artist 009의 네 번째 손님 위치에 오고, 의자·하체는 서비스 테이블 뒤에서 자연스럽게 이어진다."
  },
  "spatialOrder": [
    "player-camera-inside-bar",
    "single-bar-counter",
    "customer-seats",
    "main-entrance-immediately-behind-customer-side",
    "night-alley"
  ],
  "topology": {
    "mainEntranceRelation": "immediately-behind-customer-side-bar",
    "entranceComposition": "single-centered-main-gate-with-closed-side-walls",
    "sideWallsRelation": "closed-from-centered-gate-to-left-and-right-frame-edges",
    "tableRelation": "츠키오카의 의자와 하체는 카메라와 손님 사이의 승인된 단일 긴 서비스 테이블 뒤에 놓인다",
    "customerOcclusion": "테이블 레이어가 하체·의자 일부를 가리고, 이 레이어는 그 뒤 연속되는 몸과 의자를 유지한다",
    "backgroundRelation": "중앙 대문·밤 골목·벽·선반·램프는 이 손님 레이어에 포함하지 않는다"
  },
  "occludedContinuation": [
    {
      "occluder": "single-full-width-service-table",
      "hiddenSurfaceMustContinueAs": "츠키오카의 하체와 단일 목재 의자가 테이블 뒤에서 자연스럽게 계속된다"
    }
  ],
  "invariants": [
    "녹색 가디건, 회색으로 넘긴 머리, 가는 둥근 안경의 노년 일본인 남성 한 명만 담는다",
    "대기 상태는 주문 미수령 상태다: 손은 비고 맥주·네기마·접시·컵·음식·음료가 없다",
    "한 개의 목재 바 의자만 포함하며, 의자는 정면 카메라를 똑바로 향하는 대칭 정면형이어야 한다. 다른 손님·손님석·배경은 넣지 않는다",
    "승인된 Artist 009 화면의 따뜻한 수제 픽셀 아트, 짙은 잉크 외곽, 정면 카메라, 츠키오카 위치와 비례를 따른다",
    "straight-alpha 1920×1080 complete layer로 만들고 네 모서리는 투명이다"
  ],
  "forbiddenSubstitutions": [
    "navy-suit-office-worker",
    "side-facing-or-three-quarter-view-chair",
    "other-customer-or-extra-chair",
    "beer-mug-negima-food-drink-plate-tray-utensil-or-order-mat",
    "ui-text-quantity-check-gauge-panel-button-or-badge",
    "sealed-rear-wood-wall",
    "full-width-bottle-shelf-wall",
    "deep-back-room",
    "second-counter",
    "off-center-main-entrance",
    "open-side-entrance-bays",
    "door-alley-wall-shelf-lantern-or-any-scene-background",
    "cast-shadow-reflection-or-chroma-background"
  ],
  "inferenceSummary": "새 전체 화면을 그리지 않는다. 사용자 지정 Artist 009 기준의 네 번째 손님 츠키오카를, 주문 미수령 대기라는 단일 상태 레이어로만 재구성한다. 수령(식사)은 이 후보 승인 뒤 별도 자산으로 만든다.",
  "unresolvedQuestions": [],
  "approval": {
    "status": "user-confirmed",
    "basis": "사용자가 대기와 수령(식사) 에셋 필요를 지시했고, 츠키오카 정체성을 녹색 옷을 입은 할아버지로 명시했다",
    "date": "2026-07-28"
  },
  "approvedForGeneration": true
}
